{
  "code": "ug-lsc",
  "name": "Uganda Lower Secondary (S1 to S4) - competency-based curriculum, UCE",
  "version": "1.0.0",
  "country": "UG",
  "issuers": [
    "NCDC",
    "UNEB",
    "Ministry of Education and Sports"
  ],
  "effective_from": "2026-01-01",
  "languages": [
    "en",
    "sw"
  ],
  "requires_engine": ">=1.0.0",
  "sources": [
    {
      "title": "Lower Secondary Curriculum Embraced (new competency-based curriculum rolled out from S1 in 2020)",
      "issuer": "NCDC",
      "url": "https://ncdc.go.ug/lower-secondary-curriculum-embraced/",
      "retrieved": "2026-10-26"
    },
    {
      "title": "Project theme for Senior Three 2025 and the Project Assessment and Observation checklist",
      "issuer": "UNEB",
      "url": "http://web.archive.org/web/2026id_/https://uneb.ac.ug/wp-content/uploads/2025/04/Guidelines-and-theme-for-project-assessment.-web.pdf",
      "retrieved": "2026-10-26"
    },
    {
      "title": "UNEB home page and Directorate of Examinations (mandate and registration of UCE candidates)",
      "issuer": "UNEB",
      "url": "http://web.archive.org/web/20261018080826/https://uneb.ac.ug/executive-director/directorte_of_examinations/",
      "retrieved": "2026-10-26"
    },
    {
      "title": "School calendars (the 2026 calendar is published as a scanned PDF)",
      "issuer": "Ministry of Education and Sports",
      "url": "https://www.education.go.ug/school-calendars/",
      "retrieved": "2026-10-26"
    }
  ],
  "verification": {
    "status": "draft",
    "verified_by": [],
    "notes": "Draft, not reviewed by an NCDC or UNEB officer. Confirmed from fetched sources: the competency-based lower secondary curriculum began with S1 in 2020; UNEB assesses a school-based project in S3 against a checklist of competences and indicators. NOT confirmed (UNEB's live site was unreachable and the NCDC lower secondary assessment framework was not retrieved): UNEB's current UCE reporting format and achievement levels, the weight of continuous assessment and project work against the end-of-cycle examination, the subject list and any national subject codes (the legacy UCE codes of 2016 do not apply to the new curriculum, so national_code is null), and compulsory/elective combination rules. The A-E scale and the 20/80 split are school-overridable defaults for internal reports; they are not UNEB's grading. No UCE aggregate is modelled."
  },
  "overridable": [
    "grading_scales.lsc_grade.bands",
    "assessment.schemes.*.slots.*.scale_to",
    "reports.*.page"
  ]
}
